{
  "bl_number": "NB21070787",
  "booking_number": "28NGLA0374",
  "carrier_name": "NINGBO BURNASIA INTERNATIONAL LOGISTICS CO.,LTD.",
  "shipper": {
    "name": "SINPEX CONNECTION LOGISTICS (NINGBO) LIMITED",
    "address": {
      "raw": "ROOM 1806,18/F,NINGBO GLOBAL SHIPPING\nSQUARE,269 NING DONG ROAD,YINZHOU DISTRICT,\nNINGBO,ZHEJIANG PROVINCE,CHINA.315000",
      "po_box": null,
      "street": "ROOM 1806,18/F,NINGBO GLOBAL SHIPPING\nSQUARE,269 NING DONG ROAD",
      "district": "YINZHOU DISTRICT",
      "city": "NINGBO",
      "postal_code": "315000",
      "state": "ZHEJIANG PROVINCE",
      "country_code": "CN"
    }
  },
  "consignee": {
    "name": "APEX LOGISTICS INTERNATIONAL (LAX), INC.",
    "address": {
      "raw": "18554 S. SUSANA ROAD RANCHO DOMINGUEZ CA ,90221 USA",
      "po_box": null,
      "street": "18554 S. SUSANA ROAD",
      "district": null,
      "city": "RANCHO DOMINGUEZ",
      "postal_code": "90221",
      "state": "CA",
      "country_code": "US"
    }
  },
  "notify_party": null,
  "place_of_receipt": "NINGBO,CHINA",
  "vessel_name": "AS CONSTANTINA V.2130E",
  "voyage_number": "2130E",
  "port_of_loading": {
    "locode": null,
    "name": "NINGBO",
    "country": "CN"
  },
  "port_of_discharge": {
    "locode": null,
    "name": "LOS ANGELES",
    "country": "US"
  },
  "place_of_delivery": "LOS ANGELES, USA",
  "marks_and_numbers": "N/M",
  "containers": [
    {
      "container_number": "BURU6642366",
      "seal_number": "BAL207585",
      "container_type": "45G1",
      "packages_count": 1080,
      "package_kind": "CT",
      "goods_description": "100% POLYESTER BLANKET",
      "gross_weight_kg": 7452,
      "volume_cbm": 65.39
    },
    {
      "container_number": "BURU6644733",
      "seal_number": "BAL204345",
      "container_type": "45G1",
      "packages_count": 1240,
      "package_kind": "CT",
      "goods_description": "100% POLYESTER BLANKET",
      "gross_weight_kg": 7688,
      "volume_cbm": 64.6
    },
    {
      "container_number": "BURU6642807",
      "seal_number": "BAL204379",
      "container_type": "45G1",
      "packages_count": 1181,
      "package_kind": "CT",
      "goods_description": "100% POLYESTER BLANKET",
      "gross_weight_kg": 7539.2,
      "volume_cbm": 64.15
    },
    {
      "container_number": "BURU6644440",
      "seal_number": "BAL204341",
      "container_type": "45G1",
      "packages_count": 1424,
      "package_kind": "CT",
      "goods_description": "100% POLYESTER BLANKET",
      "gross_weight_kg": 6784.8,
      "volume_cbm": 59.46
    }
  ],
  "total_packages": 4925,
  "total_gross_weight_kg": 29464,
  "total_volume_cbm": 253.6,
  "freight_terms": "FREIGHT COLLECT",
  "shipped_on_board_date": null,
  "place_of_issue": "NINGBO,CHINA",
  "date_of_issue": "2021-08-03",
  "number_of_originals": null
}
